{
  "$schema": "../metadata.schema.json",
  "schemaVersion": 1,
  "exportedFrom": {
    "platform": "IOS",
    "versionString": "3.2.2",
    "exportedAt": "2026-10-19T12:39:03.045Z"
  },
  "app": {
    "bundleId": "com.rainif.offworkcountdown.macappstore",
    "platform": "IOS",
    "versionString": "3.2.3",
    "createVersionIfMissing": true,
    "releaseType": "MANUAL",
    "copyright": "© 2026 fi_niaR Studio"
  },
  "localizations": {
    "ar-SA": {
      "name": "DoneAt - عداد نهاية الدوام",
      "subtitle": "جدول المناوبات والراتب اليومي",
      "privacyPolicyUrl": "https://doneat.app/en/privacy",
      "privacyChoicesUrl": null,
      "promotionalText": "كم بقي على نهاية الدوام وكم كسبت اليوم، بمجرد فتح التطبيق. جديد: خطّط لإجازتك وشاهد كل الخيارات على التقويم. ومصمم أيضًا لـ iPhone Duo.",
      "description": "كم ساعة بقيت حتى نهاية الدوام؟ وكم كسبت اليوم؟\nDoneAt يجيبك عن السؤالين. حدّد وقت بداية الدوام ونهايته، وسيخصم العد التنازلي استراحة الغداء تلقائيًا ليعرض لك الوقت الذي بقي فعلًا من عملك. العد التنازلي الأساسي مجاني دائمًا.\n\nعلى معصمك أيضًا\nتطبيق Apple Watch مجاني. أضف المضاعفة إلى واجهة الساعة، ويكفي أن ترفع معصمك لترى كم بقي حتى نهاية الدوام.\n\nمهما كان نظام عملك\n• دوام مكتبي، أسابيع متناوبة، ورديات دوّارة، ورديات ليلية بعد منتصف الليل: يمكنك جدولة كل ذلك.\n• حدّد استراحة الغداء بنفسك. أثناء الاستراحة يتوقف العد التنازلي، ولا يُحسب هذا الوقت من ساعات عملك.\n• جئت مبكرًا، أو ستنصرف مبكرًا، أو لديك وقت إضافي، أو تريد حساب يوم خارج الجدول؟ غيّر ذلك اليوم فقط، دون المساس بجدولك كله.\n• الجدول الحر: ورديات غير ثابتة؟ لا مشكلة، رتّب كل يوم بنفسك. مع الفرشاة يصبح الأمر سريعًا: اختر وردية، ثم اضغط على التقويم أو مرّر إصبعك عليه. مواعيد مختلفة في فترة معينة من كل عام؟ يمكن للورديات تغيير أوقاتها تلقائيًا حسب التاريخ.\n• تريد رؤية أجرك؟ فعّل «الأجر المكتسب اليوم» مع ملخصات الأسبوع والسنة. لا تريد؟ اتركه مغلقًا.\n• تذكيرات ببداية الدوام ونهايته، والغداء، ووقت النهوض والحركة.\n• خطّط لإجازتك: سجّل كم بقي لك من الإجازة السنوية وأيام التعويض، وسيبحث DoneAt وفق العطلات وجدولك عن الخطط الممكنة، ويضيف الخطة التي تختارها بلمسة واحدة.\n\nدون فتح التطبيق\nويدجت على الشاشة الرئيسية وشاشة القفل، والأنشطة المباشرة وDynamic Island على طرازات iPhone المدعومة. ولكلٍّ من الوضع الأفقي على iPhone والشاشة الكبيرة على iPad تصميم خاص. شارك العد التنازلي كصورة أو رابط. متوفر بـ19 لغة ويتبع لغة النظام.\n\nمصمم لـ iPhone Duo\nعند فتحه، تنقسم كل صفحة إلى عمودين لترى أكثر دفعة واحدة. وعند طيّه إلى النصف، يظهر العد التنازلي في شاشة مقسّمة.\n\nمجاني للاستخدام\nالعد التنازلي مجاني دائمًا. تصفّح سجلات آخر 7 أيام كما تشاء، وصدّر بياناتك أو احذفها مجانًا، واطّلع على إجمالي ساعات الوقت الإضافي. وفي تخطيط الإجازات، لديك 3 عمليات بحث مجانية؛ وكل الخطط التي يجدها البحث، مع تفاصيلها، تتصفحها كما تشاء، والبحث الذي لا يجد نتائج لا يُحتسب، وإضافة الخطة إلى التقويم أو التراجع عنها لا تكلّف شيئًا.\n\nيشمل DoneAt Plus:\n• السجلات الأقدم وعرض السنة وتعديل الأيام السابقة.\n• عرض الحياة: أضف محطات حياتك وراتب كل وظيفة، وانظر إلى الماضي، وقدّر تقريبًا كم ستكسب طوال حياتك قبل الضرائب.\n• تركيز: رتّب المهام وفترات التركيز والراحة. لا يقتطع المؤقت من استراحة الغداء ولا يتجاوز نهاية الدوام.\n• مزامنة iCloud. إذا انتهى الاشتراك، تستمر المزامنة المفعّلة من قبل.\n• البحث عن خطط الإجازات بلا حدود.\n• منبهات المناوبة: توقظك في الوقت الذي تحدده قبل كل مناوبة.\n• تقارير أسبوعية وشهرية وسنوية لترى كم عملت وكم ارتحت.\n\nاشترك شهريًا أو سنويًا، أو احصل على خيار مدى الحياة بشراء واحد بسعر مناسب. تتجدد الاشتراكات تلقائيًا، ويمكنك الإلغاء في أي وقت.\n\nبياناتك بين يديك\nتبقى بياناتك افتراضيًا على جهازك فقط. وعند تفعيل مزامنة iCloud، تُحفظ السجلات والراتب والإعدادات في قاعدة بياناتك الخاصة لدى Apple. لا تعرض الإشعارات سوى الوقت والتقدم، ولا تعرض الراتب؛ والصور والروابط التي تشاركها لا تتضمن سوى مواعيد الدوام. بلا تسجيل ولا إعلانات.\n\nتابعنا لتعرف آخر أخبار DoneAt أولًا بأول:\nX: @DoneAtApp\nالموقع الرسمي: https://doneat.app/\n\nشروط الاستخدام: https://www.apple.com/legal/internet-services/itunes/dev/stdeula/\nالخصوصية: https://doneat.app/en/privacy",
      "keywords": "دوام,وردية,ورديات,شفت,حاسبة,عطلة,رسمية,إجازة,منبه",
      "supportUrl": "https://doneat.app/en/about",
      "marketingUrl": "https://doneat.app/",
      "whatsNew": "مع هذا التحديث، أصبح DoneAt على الشاشة الرئيسية وشاشة القفل ومركز التحكم وApple Watch.\n• الشاشة الرئيسية: أنماط جديدة للعد التنازلي (أرقام كبيرة، وحلقة مقسّمة، وخط زمني لليوم، وعرض تفصيلي)، إلى جانب «هذا الأسبوع» و«الورديات» و«تقدّم السنة» و«حتى عطلة الأسبوع» و«العطلة القادمة». ومع DoneAt Plus: «ملخص العمل» و«الحياة» و«تركيز».\n• شاشة القفل ومركز التحكم: أضئ الشاشة لترى كم تبقّى، وابدأ ورديتك بلمسة واحدة.\n• Apple Watch: أصبح مضمّن العد التنازلي مقسّمًا عند استراحة الغداء، ويتوفر أيضًا بنمطي الزاوية والسطر. وتعرض مضمّنات جديدة هذا الأسبوع، ووردية اليوم أو الغد، وعطلة الأسبوع، والعطلة القادمة، وما هو قادم.\n• في الإعدادات > الأدوات، شاهد كل أداة بجدولك أنت، وتعرّف على طريقة إضافتها.\n• إصلاحات: توقّف التطبيق أحيانًا عند فتح إشعار، وتذكيرات قد لا تصل، وعدّ تنازلي في «الأنشطة المباشرة» يتقدّم بضع ثوانٍ، وإغلاق تطبيق Watch في الخلفية."
    },
    "de-DE": {
      "name": "DoneAt - Feierabend Countdown",
      "subtitle": "Schichtplan, Dienstplan & Lohn",
      "privacyPolicyUrl": "https://doneat.app/en/privacy",
      "privacyChoicesUrl": null,
      "promotionalText": "Wann ist Feierabend, was hast du heute verdient? App auf, alles da. Neu: Urlaub planen mit allen Optionen im Kalender. Und gemacht fürs iPhone Duo.",
      "description": "Wie viele Stunden noch bis Feierabend? Was hast du heute schon verdient?\nDoneAt beantwortet genau diese zwei Fragen. Trag Arbeitsbeginn und -ende ein, und der Countdown zieht deine Mittagspause automatisch ab – so siehst du, wie lange du wirklich noch arbeiten musst. Der einfache Feierabend-Countdown ist kostenlos.\n\nAuch am Handgelenk\nDie Apple Watch-App ist kostenlos. Mit der Komplikation auf dem Zifferblatt reicht ein Blick aufs Handgelenk, und du weißt, wie lange es noch dauert.\n\nEgal, wie du arbeitest\n• Feste Arbeitszeiten, Wechselwochen, Wechselschicht oder Nachtschicht über Mitternacht – du kannst alles planen.\n• Deine Mittagspause legst du selbst fest. Während der Pause hält der Countdown an, und die Zeit zählt nicht zu deiner Arbeitszeit.\n• Früher angefangen, früher Schluss, Überstunden oder ein ungeplanter Arbeitstag? Ändere einfach diesen Tag, nicht den ganzen Dienstplan.\n• Freier Dienstplan: Keine festen Schichten? Kein Problem, du planst jeden Tag selbst. Mit dem Pinsel geht's schnell: Schicht wählen, dann im Kalender antippen oder drüberwischen. Sommer- und Winterzeiten? Schichten wechseln ihre Zeiten automatisch nach Datum.\n• Willst du dein Gehalt sehen, schalte „Heute verdient“ ein, dazu Wochen- und Jahresübersichten. Wenn nicht, lass es einfach aus.\n• Erinnerungen an Arbeitsbeginn, Feierabend, Mittagspause und ans Aufstehen und Bewegen.\n• Urlaub planen: Trag ein, wie viel Jahresurlaub und Freizeitausgleich du noch hast. DoneAt findet passend zu Feiertagen und Dienstplan die machbaren Auszeiten und übernimmt deine Wahl mit einem Tippen.\n\nOhne die App zu öffnen\nWidgets auf dem Home- und Sperrbildschirm, dazu Live-Aktivitäten und Dynamic Island auf unterstützten iPhone-Modellen. Für das iPhone im Querformat und das große iPad-Display gibt es eigene Layouts. Teile deinen Countdown als Bild oder Link. Verfügbar in 19 Sprachen, passend zur Systemsprache.\n\nGemacht fürs iPhone Duo\nAufgeklappt zeigt jede Seite zwei Spalten, damit du mehr auf einmal siehst. Halb zugeklappt erscheint der Countdown im geteilten Bildschirm.\n\nKostenlos nutzbar\nDer Feierabend-Countdown ist immer kostenlos. Die Einträge der letzten 7 Tage kannst du dir beliebig ansehen, Export und Löschen kosten nichts, und deine gesamten Überstunden werden ebenfalls angezeigt. Bei der Urlaubsplanung hast du 3 kostenlose Plansuchen. Alle Pläne einer Suche kannst du samt Details beliebig ansehen, eine Suche ohne Treffer zählt nicht, und einen Plan in den Kalender übernehmen oder rückgängig machen kostet nichts.\n\nDoneAt Plus enthält:\n• Ältere Einträge, die Jahresansicht und das Nachtragen vergangener Tage.\n• Lebensansicht: Ergänze Lebensstationen und das Gehalt jeder Arbeitsphase, blick zurück und schätz ab, was du im Leben ungefähr brutto verdienst.\n• Fokus: Plane Aufgaben, Fokus- und Pausenblöcke. Der Timer lässt deine Mittagspause in Ruhe und läuft nie über den Feierabend hinaus.\n• iCloud-Synchronisierung. Läuft dein Abo aus, bleibt eine bereits aktive Synchronisierung bestehen.\n• Unbegrenzt viele Plansuchen in der Urlaubsplanung.\n• Schichtwecker: Vor jeder Schicht weckt er dich zu der Zeit, die du festlegst.\n• Wochen-, Monats- und Jahresberichte: Wie viel hast du gearbeitet, wie viel hast du dich erholt?\n\nAbonniere monatlich oder jährlich oder sichere dir lebenslangen Zugriff mit einem günstigen Einmalkauf. Abos verlängern sich automatisch und lassen sich jederzeit kündigen.\n\nDeine Daten gehören dir\nDeine Daten bleiben standardmäßig nur auf deinem Gerät. Mit der iCloud-Synchronisierung landen Einträge, Gehalt und Einstellungen in deiner eigenen privaten Apple-Datenbank. Mitteilungen zeigen nur Zeit und Fortschritt, nie dein Gehalt; geteilte Bilder und Links enthalten nur Schichtzeiten. Keine Anmeldung, keine Werbung.\n\nFolge uns, damit du Neuigkeiten zu DoneAt als Erstes erfährst:\nX: @DoneAtApp\nWebsite: https://doneat.app/\n\nNutzungsbedingungen: https://www.apple.com/legal/internet-services/itunes/dev/stdeula/\nDatenschutz: https://doneat.app/en/privacy",
      "keywords": "Schichtkalender,Schichtarbeit,Wechselschicht,Nachtschicht,Arbeitszeit,Urlaub,Brückentage,Wecker",
      "supportUrl": "https://doneat.app/en/about",
      "marketingUrl": "https://doneat.app/",